{
  "run_id": "20260726-py-fix-off-by-one-claude-code-qwen3.8-max-preview-01",
  "task_id": "py-fix-off-by-one",
  "verifier": {
    "passed": 0,
    "total": 1,
    "score": 0.0,
    "exit_code": 127,
    "log_excerpt": "\n/bin/sh: python: command not found\n"
  },
  "process_signals": {
    "planning": false,
    "plan_items": 0,
    "plan_completed": 0,
    "scope_adherence": 1.0,
    "self_test_after_last_edit": true,
    "self_test_kind": "adhoc",
    "retry_pattern_max": 15,
    "failed_tool_calls": 58
  }
}
