{
  "run_id": "20260802-py-task-tracker-opencode-deepseek-v4-flash-0731-01",
  "task_id": "py-task-tracker",
  "verifier": {
    "passed": 20,
    "total": 20,
    "score": 100.0,
    "exit_code": 0,
    "status": "ok",
    "log_excerpt": "....................                                                     [100%]\n20 passed in 1.75s\n\n"
  },
  "process_signals": {
    "planning": true,
    "plan_items": 5,
    "plan_completed": 5,
    "scope_adherence": 0.2,
    "self_test_after_last_edit": true,
    "self_test_kind": "framework",
    "retry_pattern_max": 0,
    "failed_tool_calls": 1
  }
}
