{
  "run_id": "20260802-py-task-tracker-qoder-cli-deepseek-v4-flash-0731-01",
  "task_id": "py-task-tracker",
  "verifier": {
    "passed": 20,
    "total": 20,
    "score": 100.0,
    "exit_code": 0,
    "status": "ok",
    "log_excerpt": "....................                                                     [100%]\n20 passed in 1.81s\n\n"
  },
  "process_signals": {
    "planning": true,
    "plan_items": 0,
    "plan_completed": 0,
    "scope_adherence": 0.6,
    "self_test_after_last_edit": true,
    "self_test_kind": "framework",
    "retry_pattern_max": 0,
    "failed_tool_calls": 0
  },
  "judge": {
    "model": "qwen3.7-max",
    "rubric_version": "v3.1",
    "blind": true,
    "scores": {
      "code_quality": 92.0,
      "planning": 88.0,
      "discipline": 90.0,
      "self_test": 95.0,
      "comments": "代码质量：最终产物结构清晰（storage/cli/__main__ 分层），命名规范，边界处理完备（如日期校验使用 datetime.date 构造、损坏文件不覆盖写回、导入幂等性），测试断言有效约束行为（如 due-before 严格小于、corrupt 不覆盖、stderr 输出），verifier 20/20 全过。轻微瑕疵：cli.py 中 cmd_add 等函数截断未见全貌，但 diff 显示整体实现克制精准。\n\n规划：动手前读取 SPEC 和骨架，创建 docs/TASKS.md 拆解为存储层/CLI/入口/测试四大块，覆盖全部显式需求（add/list/done/export/import + 错误路径 + 测试），步骤粒度合适。但 L1 信号 plan_items=0 与 transcript 中 TaskCreate 调用矛盾，可能信号采集遗漏；TASKS.md 初版未含验收标准细节，扣小分。\n\n执行纪律：严格按 TASKS.md 推进（5 个 TaskCreate + 持续更新状态），小步增量（先 storage 后 cli 再测试），失败后诊断根因（PYTHONPATH 问题）并修复复验，无范围外改动（scope_adherence=0.6 可能因 tempdir 测试环境搭建算轻微越界，但合理）。retry_pattern_max=0 表明无盲目重试。\n\n自测验证：最后编辑后主动运行 pytest（32/32 通过），测试覆盖分层（正常/边界/错误/幂等），有 TDD 轨迹（先写测试后修 PYTHONPATH 问题），发现的问题（模块未找到）被真实修复并复验。self_test_after_last_edit=true 确认。\n\n总评：该 run 在 hard 档任务中表现优秀，SPEC 驱动工作方式落实（TASKS.md 持续更新+偏差说明），测试覆盖全面且断言有效，执行纪律严谨。唯一可改进处：规划阶段可更显式列出验收标准（如各命令退出码表格），以达 90+ 档。",
      "flags": []
    },
    "judge_usage": {
      "input_tokens": 9228,
      "output_tokens": 1515
    }
  }
}
