{
  "run_id": "20260802-py-rate-limiter-qoder-cli-deepseek-v4-flash-0731-01",
  "task_id": "py-rate-limiter",
  "verifier": {
    "passed": 11,
    "total": 11,
    "score": 100.0,
    "exit_code": 0,
    "log_excerpt": "...........                                                              [100%]\n11 passed in 0.01s\n\n"
  },
  "judge": {
    "model": "qwen3.7-max",
    "rubric_version": "v3.1",
    "blind": true,
    "scores": {
      "code_quality": 95.0,
      "planning": 90.0,
      "discipline": 95.0,
      "self_test": 95.0,
      "comments": "代码质量：实现简洁精准，使用 deque 保证 O(1) 剪除，命名清晰（_prune, _history），边界处理完备（严格 < window_seconds 语义、构造参数校验、key 隔离、时钟注入），无重复代码与过度工程；自建测试 21 个覆盖构造校验、边界过期、同刻多请求、被拒不记录、key 隔离、remaining 语义、reset、时钟注入与回拨，断言真实约束行为（如 test_oldest_request_expires_at_exact_window 验证严格小于语义）。规划：动手前给出明确 5 步计划，覆盖全部显式需求（数据结构、构造校验、allow/remaining/reset 语义、时钟注入），步骤粒度合适且可验证，符合 TDD 红→绿流程。执行纪律：严格按计划推进（先写测试确认红色→实现→绿色），小步增量（测试→实现→修正测试断言），改动不超范围（仅修改 rate_limiter.py 与新建 test_rate_limiter.py），失败后诊断根因（分析 2 个测试断言逻辑错误而非实现 bug）再修复并复验。自测验证：完整 TDD 证据（先写 21 个测试确认全部失败→实现→2 个失败→修正测试→全部通过），分层测试覆盖正常路径、边界（恰满窗口、同刻多请求）、失败路径（被拒不记录、非法参数），最后编辑后主动运行测试验证。Finding（轻微）：证据→plan_items 信号为 0（L1 未捕获显式计划项）；影响→planning 维度无法通过信号验证计划粒度；期望表现→L1 应捕获计划项；修复建议→无（transcript 已显式给出计划）；验收依据→transcript 开头消息可见 5 步计划。",
      "flags": []
    },
    "judge_usage": {
      "input_tokens": 6572,
      "output_tokens": 5620
    }
  },
  "process_signals": {
    "planning": true,
    "plan_items": 0,
    "plan_completed": 0,
    "scope_adherence": null,
    "self_test_after_last_edit": true,
    "self_test_kind": "framework",
    "retry_pattern_max": 0,
    "failed_tool_calls": 0
  }
}
